"n/a","n/a","Lithium To Acquire Social Influence Scoring Site Klout For?$200M","http://techcrunch.com/2014/03/26/lithium-to-acquire-social-influence-scoring-site-klout-for-200m/"
"n/a","n/a","Aereo Says A Win For Broadcasters Would Have ?Chilling? Consequences To Cloud?Computing","http://techcrunch.com/2014/03/26/aereo-says-a-win-for-broadcasters-would-have-chilling-consequences-to-cloud-computing/"
"n/a","n/a","Yo Instacart, Can I Get Some Shareable Grocery?Lists?","http://techcrunch.com/2014/03/26/groceries-gone-social/"
"n/a","n/a","Box Unveils First Standalone Product And New API Pricing At Inaugural Dev?Conference","http://techcrunch.com/2014/03/26/box-unveils-first-standalone-product-and-new-api-pricing-at-inaugural-dev-conference/"
"n/a","n/a","With Revenue Up 2.4X In The Past Two Months, Instacart Lands In?NYC","http://techcrunch.com/2014/03/26/with-revenue-up-2-4x-in-the-past-two-months-instacart-lands-in-nyc/"
"n/a","n/a","Digital Ad Company CPXi Raises $30M In Its First Outside?Funding","http://techcrunch.com/2014/03/26/cpxi-30-million/"
"n/a","n/a","Using Analytics, Bloomberg Beta Seeks Out Startup?Founders","http://techcrunch.com/2014/03/26/using-analytics-bloomberg-beta-seeks-out-startup-founders/"
"n/a","n/a","Online Engagement Ring Buyer?Beware","http://techcrunch.com/2014/03/26/online-engagement-ring-buyer-beware/"
"n/a","n/a","Microsoft And Dell Sign Patent Royalty Agreement For Android And Chrome OS?Devices","http://techcrunch.com/2014/03/26/microsoft-and-dell-sign-patent-royalty-agreement-for-android-and-chrome-os-devices/"
"n/a","n/a","Mobile Users, Women Shoppers Fuel India?s E-Commerce?Boom","http://techcrunch.com/2014/03/26/inside-indias-e-commerce-boom-growing-base-of-mobile-internet-users-women-shoppers-and-several-infrastructure-bottlenecks/"
"n/a","n/a","Twitter Tests More Inviting Profile Designs On?Mobile","http://techcrunch.com/2014/03/26/twitter-tests-more-inviting-profile-designs-on-mobile/"
"n/a","n/a","Twitter Adds People Tagging And Multiple Photo Sharing To?Tweets","http://techcrunch.com/2014/03/26/twitter-bolsters-image-support-with-people-tagging-and-multiple-photos-per-tweet/"
"n/a","n/a","Timehop Brings Its Mobile Time Machine To?Android","http://techcrunch.com/2014/03/26/timehop-brings-its-mobile-time-machine-to-android/"
"n/a","n/a","King Falls 15% On Its IPO Day, Erasing $1.1B In Market?Cap","http://techcrunch.com/2014/03/26/king-falls-15-on-its-ipo-day-erasing-1-1b-in-market-cap/"
"n/a","n/a","Google?s I/O Registration Lottery Happens April 8 ? 10: May The Odds Be Ever In Your?Favor","http://techcrunch.com/2014/03/26/googles-io-registration-lottery-happens-april-8-10-may-the-odds-be-ever-in-your-favor/"
"n/a","n/a","Vice Media?s Shane Smith To Join Us At TechCrunch Disrupt?NY","http://techcrunch.com/2014/03/26/vice-medias-shane-smith-to-join-us-at-techcrunch-disrupt-ny/"
"n/a","n/a","Build Your Own Makerbot-Inspired Robotic Tattoo?Machine","http://techcrunch.com/2014/03/26/build-your-own-makerbot-inspired-robotic-tattoo-machine/"
"n/a","n/a","BlackBerry Sued An Executive Who Defected To?Apple","http://techcrunch.com/2014/03/26/blackberry-sued-an-executive-who-defected-to-apple/"
"n/a","n/a","A Brief History Of?Oculus","http://techcrunch.com/2014/03/26/a-brief-history-of-oculus/"
"n/a","n/a","In Response To Google, Amazon Announces Massive Price Cuts For S3, EC2, ElastiCache, Elastic MapReduce And?RDS","http://techcrunch.com/2014/03/26/in-response-to-google-amazon-announces-massive-price-cuts-for-s3-ec2-and-rds/"
